{
  "schema_version": 3,
  "id": "typical-sampling",
  "type": "reusable",
  "kind": "blog",
  "title": "What is Typical Sampling",
  "date": "2024-03-22",
  "summary": "Journey from speculative sampling to typical sampling: learning notes on transformer inference and temperature.",
  "content": "content.md",
  "tags": [
    "reusable_version_1",
    "Transformer Inference",
    "Truncate Sampling"
  ],
  "attachments": [
    {
      "path": "typical-sampling.jpg",
      "alt": "Original Typical Sampling article cover",
      "kind": "image"
    }
  ],
  "aliases": [
    "/post/typical-sampling/"
  ],
  "updated": "2026-09-12"
}
