{
  "schema_version": 3,
  "id": "improving-multi-candidate-speculative-decoding",
  "type": "reusable",
  "kind": "paper",
  "title": "Improving Multi-candidate Speculative Decoding",
  "date": "2024-09-16",
  "updated": "2026-09-12",
  "summary": "My first paper: exploring target-initialized candidate trees and adaptive drafting for faster LLM inference.",
  "content": "content.md",
  "tags": [
    "reusable_version_1",
    "LLM Inference",
    "Speculative Decoding"
  ],
  "attachments": [
    {
      "path": "multi-candidate-decoding.png",
      "alt": "Comparison of draft-initialized and target-initialized multi-candidate generation",
      "kind": "image",
      "caption": "Figure 1 from arXiv:2409.10644v3."
    }
  ]
}
