{
  "schema_version": 3,
  "id": "trending-analysis-20260916-0942",
  "type": "reusable",
  "kind": "character",
  "title": "每日趋势分析 · Trending Analysis",
  "date": "2026-09-16",
  "updated": "2026-09-28",
  "summary": "A habit tracker, started 2026-09-16. Every day I read the top of all four trending sources — GitHub Trending, Product Hunt, Hacker News, Google Trends — then pick whichever ones I actually want to think about and write down what I could do with them: join it, build something similar, or steal the…",
  "content": "content.md",
  "tags": [
    "reusable_version_1",
    "habit"
  ],
  "attachments": [
    {
      "path": "trending-analysis-20260916-0942-file-20260916093741759.png",
      "alt": "fugleramme, a bird-identifying photo frame, on Hacker News",
      "kind": "image"
    }
  ]
}
