{
  "schema_version": 3,
  "id": "decision-log-publishing-pipeline",
  "type": "reusable",
  "kind": "system",
  "title": "Diary Plan → Decision Log",
  "date": "2026-09-14",
  "updated": "2026-09-17",
  "summary": "Turn one diary's Plan section into a public, bilingual Decision Log entry with a GitHub discussion. Keep the priority order, reasons, and task status while making the writing easier to review. The rest of the diary stays private.",
  "content": "content.md",
  "tags": [
    "reusable_version_1",
    "publishing"
  ],
  "attachments": []
}
