{
  "schema_version": 3,
  "id": "zotnavigator",
  "type": "reusable",
  "kind": "project",
  "title": "ZotNavigator",
  "date": "2023-10-24",
  "summary": "A project from my time at UC Irvine; the pitch deck is the fullest account of what it does.",
  "content": "content.md",
  "tags": [
    "reusable_version_1",
    "project",
    "uci"
  ],
  "attachments": [
    {
      "path": "zotnavi.png",
      "alt": "ZotNavigator project screenshot",
      "kind": "image"
    }
  ],
  "updated": "2026-09-12"
}
