{
  "schema_version": 3,
  "id": "study-note-three-ways-to-calculate-euclidean-distance-and-understanding-numpy-broadcasting-20260917-1214",
  "type": "reusable",
  "kind": "knowledge",
  "title": "Three Ways to Calculate Euclidean Distance, and Understanding NumPy Broadcasting",
  "date": "2026-09-17",
  "updated": "2026-09-17",
  "summary": "Xtest[i, :] - Xtrain — a vector minus a matrix — is not a defined operation in linear algebra, yet NumPy runs it without complaint. This note works out why: a matrix is a stack of row vectors, so v - M is just v minus each row, stacked back the same way. That one reframe turns NumPy broadcasting…",
  "content": "content.md",
  "tags": [
    "reusable_version_1"
  ],
  "attachments": []
}
