{
  "schema_version": 3,
  "id": "dopamine-control-challenge",
  "type": "reusable",
  "kind": "character",
  "title": "控制多巴胺挑战 · Dopamine Control Challenge",
  "date": "2026-09-14",
  "updated": "2026-09-28",
  "summary": "A smaller, 30-day challenge supporting my ReferralChallenge: protect my attention so I spend more time learning, building, and moving. The aim is to make room for at least five hours of work in progress each day. “控制多巴胺” is my shorthand for changing my media habits.",
  "content": "content.md",
  "tags": [
    "reusable_version_1",
    "challenge"
  ],
  "attachments": []
}
